date,presenter,pmid,title,journal,authors,doi,abstract,notes,pdf
2025-Nov,,40938508,Beyond Quantification: Considerations for Immune Profiling in Chronic Rhinosinusitis Subtypes.,International forum of allergy & rhinology,"Wu, Jinyu; Yu, Shiquan",10.1002/alr.70034,,,
2025-11-01,,40932732,Patient-Centered Approach to Assessing Voice Impairment.,JAMA otolaryngology-- head & neck surgery,"Willard, Elizabeth G; Carroll, Thomas L; Kim, Minjee; Stanlie, Ayako; Rosen, Clark A et al.",10.1001/jamaoto.2025.2691,"IMPORTANCE: The Voice Handicap Index-10 (VHI-10) is an established instrument with clear utility. However, national agencies are emphasizing the importance of patient-centered assessments beyond diagnostic test results. How patients view the VHI-10 and its items is not known. OBJECTIVE: To understand patients' perceptions of the VHI-10 items and to identify a potential subset of 6 items for use as a shorter patient-centered assessment. DESIGN, SETTING, AND PARTICIPANTS: This was a prospective ps...",,
2025-11-01,,40932730,Queries and Comments Regarding the Costs and Benefits of Intraoperative Autofluorescence for Identifying Parathyroid.,JAMA otolaryngology-- head & neck surgery,"Krisnatrey, Prachi; Mishra, Anjali",10.1001/jamaoto.2025.3050,,,
2025-11-04,,40932726,Current and Future Medications for Obesity Treatment.,JAMA,"Kushner, Robert F; Jastreboff, Ania M; Ryan, Donna H",10.1001/jama.2025.13665,,,
2025-11-01,,40932708,Queries and Comments Regarding the Costs and Benefits of Intraoperative Autofluorescence for Identifying Parathyroid-Reply.,JAMA otolaryngology-- head & neck surgery,"Serrao-Brown, Hazel G; Papachristos, Alexander J; Sidhu, Stanley B",10.1001/jamaoto.2025.3053,,,
2025-11-04,,40932706,What Is Scabies?,JAMA,"Roberts, Krista",10.1001/jama.2025.13679,,,
2025-11-01,,40932704,Oral Lachnoanaerobaculum Levels and Survival in Patients With Head and Neck Cancer.,JAMA otolaryngology-- head & neck surgery,"Rühle, Alexander; Krausz, Máté; Monroy Ordonez, Elsa Beatriz; Heyer, Jannis; Thomsen, Andreas R et al.",10.1001/jamaoto.2025.2816,"IMPORTANCE: The oral microbiome plays a critical role in cancer treatment responses, yet its influence on outcomes in patients with head and neck squamous cell carcinoma (HNSCC) undergoing (chemo)radiotherapy remains poorly understood. Identifying specific microbiome signatures associated with treatment effectiveness could provide novel prognostic biomarkers and therapeutic targets. OBJECTIVE: To investigate the association between salivary Lachnoanaerobaculum spp abundance and treatment outcome...",,
2025-11-11,,40920508,Paying Primary Care More-Will It Work This Time?,JAMA,"Song, Zirui",10.1001/jama.2025.16467,,,
2025-11-04,,40920391,Accountable Care Organization Assignment and Outcomes and Spending for TEAM Surgical Conditions.,JAMA,"Berlin, Nicholas L; Ma, Yanlei; Zheng, Jie; Orav, John; Figueroa, Jose F et al.",10.1001/jama.2025.14013,,,
2025-Nov,,40920340,Preoperative Oral Clonidine Enhances Surgical Field Quality During Endoscopic Sinus Surgery: A Systematic Review and Meta-Analysis With Trial Sequential Analysis.,International forum of allergy & rhinology,"Albazee, Ebraheem; Abu-Zaid, Ahmed; Alajmi, Hamad; Aldaihani, Manal; Altaher, Dhari et al.",10.1002/alr.70031,"BACKGROUND: Various interventions have been proposed to enhance surgical field quality during endoscopic sinus surgery (ESS). This study evaluates whether preoperative oral clonidine enhances surgical field quality during ESS. METHODS: PubMed, Scopus, Web of Science, Embase, and CENTRAL databases were searched. Eligible randomized controlled trials (RCTs) were assessed for quality using the risk of bias (RoB)-2 tool. The primary outcome was surgical field quality. Secondary outcomes included int...",,
2025-11-04,,40914902,High Blood Pressure in Childhood and Premature Cardiovascular Disease Mortality.,JAMA,"Freedman, Alexa A; Perak, Amanda M; Ernst, Linda M; Borders, Ann; Miller, Gregory E et al.",10.1001/jama.2025.14405,,,
2025-Nov,,40911435,The Risk of Rheumatic Disorders Among Patients With Rhinosinusitis: A Systematic Review and Meta-Analysis.,International forum of allergy & rhinology,"Aulakh, Arshbir; Choudhary, Pradumn; Sidhu, Gurwinder; Gigliotti, Deanna; Jun, Jane et al.",10.1002/alr.70032,"BACKGROUND: Emerging evidence suggests a possible link between rhinosinusitis and systemic rheumatic diseases; however, no meta-analysis has comprehensively examined this association to date. We aimed to investigate if patients with rhinosinusitis have a predisposition to unmasking rheumatic diseases compared to individuals without rhinosinusitis. METHODS: A comprehensive search in MEDLINE, Embase, Cochrane Library, and Web of Science was conducted until February 2025 for studies characterizing ...",,
2025-Nov,,40911423,Prevalence of Local IgE Elevation and Its Effect on Intranasal Capsaicin Therapy in the Nonallergic Rhinitis Population.,International forum of allergy & rhinology,"Shetty, Kunal R; Hasan, Salman; Bankston, Christopher; Vance, Dylan; Islam, Elaijah et al.",10.1002/alr.70020,,,
2025-Nov,,40906498,"Letter to the Editor Regarding ""Do Skin Prick Tests Predict Nasal Provocation Test Outcomes in Allergic Rhinitis Patients?"".",International forum of allergy & rhinology,"Li, Xu; Gao, Mingxia; Gao, Tingting; Jin, Peng; Zhi, Lili",10.1002/alr.70030,,,
2025-Nov,,40900615,"Response to Li et al.'s Letter to the Editor Regarding ""Do Skin Prick Tests Predict Nasal Provocation Test Outcomes in Allergic Rhinitis Patients?"".",International forum of allergy & rhinology,"Lee, Yunhyung; Park, Marn Joon",10.1002/alr.70029,,,
2025-Nov,,40891773,Neurovascular Sparing Transposition of Pterygopalatine Fossa: Anatomical Principles and Techniques.,The Laryngoscope,"Agosti, Edoardo; Alexander, A Yohan; Leonel, Luciano C P C; Mondesir, Ronsard; Graepel, Stephen et al.",10.1002/lary.32253,OBJECTIVE: Sacrifice of pterygopalatine fossa (PPF) neurovascular structures during endoscopic endonasal transpterygoid approach (EETPA) may impact a patient's comorbidity. We present anatomical and surgical techniques for maximizing PPF transposition while preserving its neurovascular structures through orbito-pterygo-sphenoidal (OPS) ligament release and descending palatine canal (DPC) decompression. METHODS: The EETPA was performed on six specimens. Two measurements were obtained to assess PP...,,
2025-11-11,,40886310,Fractional Flow Reserve-Guided Complete vs Culprit-Only Revascularization in Non-ST-Elevation Myocardial Infarction and Multivessel Disease: The SLIM Randomized Clinical Trial.,JAMA,"Pustjens, Tobias F S; Veenstra, Leo; Camaro, Cyril; Ruiters, Alexander W; Lux, Árpad et al.",10.1001/jama.2025.16189,"IMPORTANCE: The benefits of fractional flow reserve (FFR)-guided complete coronary revascularization in patients with non-ST-segment elevation myocardial infarction (NSTEMI) and multivessel disease remain unclear. OBJECTIVE: To compare FFR-guided complete revascularization of nonculprit lesions vs culprit-only revascularization in patients with NSTEMI and multivessel disease. DESIGN, SETTING, AND PARTICIPANTS: This prospective, investigator-initiated, multicenter, international randomized clinic...",,
2025-Nov,,40886293,Association of Nasal Septal Deviation and Recurrent Epistaxis in Adults.,International forum of allergy & rhinology,"Reddy, Sairisheel Gabbi; Cui, Ruifeng; Aprahamian, Armen; Seman, Andrew; Latterner, Camron et al.",10.1002/alr.70025,,,
2025-Nov,,40879571,Classification and Segmentation of Mucus Morphology Using Deep Learning During Diagnostic Nasal Endoscopy.,International forum of allergy & rhinology,"Gyawali, Dipesh; Bidwell, Jonathan; Bhatia, Sejal Shyam; Fujiwara, Akio; Mundy, Thomas et al.",10.1002/alr.70004,A pretrained deep learning model can segment and classify mucus morphologies encountered during nasal endoscopy. Strong performance for different mucus morphologies supports the detection of sinonasal inflammation. This is the first study to objectively classify mucus morphology in nasal settings.,,
2025-Nov,,40879285,Dupilumab Initiation for Surgically Refractory Chronic Rhinosinusitis With Nasal Polyps Is Associated With Differential Expression of CLC and Activation of Eicosanoid Pathways.,International forum of allergy & rhinology,"Dorismond, Christina; Lubner, Rory J; Lofgren, Daniel H; Rygalski, Chandler J; Li, Ping et al.",10.1002/alr.70019,"An untargeted transcriptomic analysis provided exploratory insight into key genes and pathways that can be used to help identify patients at risk for surgically refractory chronic rhinosinusitis with nasal polyps (CRSwNP). The Charcot-Leyden crystal gene, periostin and osteopontin-associated pathways, eicosanoid synthesis pathway, and prostaglandin/leukotriene metabolism pathway, among others, are associated with dupilumab prescription for surgically refractory chronic rhinosinusitis and may sup...",,
2025-11-04,,40875583,Artificial Intelligence in Peer Review.,JAMA,"Perlis, Roy H; Christakis, Dimitri A; Bressler, Neil M; Öngür, Dost; Kendall-Taylor, Jacob et al.",10.1001/jama.2025.15827,,,
2025-Nov,,40873416,"Reply to Letter to the Editor Regarding: ""Assessing Adequacy of Surgical Extent in CRSwNP: The Completion of Surgery Index (CoSI)"".",International forum of allergy & rhinology,"Workman, Alan; Palmer, James N",10.1002/alr.23601,,,
2025-Nov,,40873415,"Comment on ""Superior Benefits of Combining Mepolizumab With Sinus Surgery Compared to Mepolizumab Alone: Results From a Randomised 6-Month Trial"".",International forum of allergy & rhinology,"Deng, Yi; Lv, Ping",10.1002/alr.70023,,,
2025-Nov,,40855776,In Response to The Impact of Monoclonal Antibody Usage on Hearing Outcomes: A Systematic Review.,The Laryngoscope,"Hwa, Tiffany P; Arya, Priya; Salmeron, Yansy; Quimby, Alexandra E; Wong, Kevin et al.",10.1002/lary.32343,,,
2025-Nov,,40855774,In Reference to The Impact of Monoclonal Antibody Usage on Hearing Outcomes: A Systematic Review.,The Laryngoscope,"Lazzeroni, Matteo; Capaccio, Pasquale; Lechien, Jèrôme René; Lentini, Mario; Maniaci, Antonino",10.1002/lary.32344,,,
2025-11-11,,40853565,What Is Lyme Disease?,JAMA,"Patel, Baiju; Malani, Preeti N",10.1001/jama.2025.13708,,,
2025-Nov,,40842217,Effect of Inferior Turbinate Radiofrequency Procedure on Nasal Flora: A Prospective Study.,American journal of rhinology & allergy,"Bayraktar, Fatma G I; Çelik, Ragıp Ç; Berkiten, Güler; Arabaci, Çiğdem; Ak, Kenan et al.",10.1177/19458924251370502,"BackgroundInferior turbinate hypertrophy is a common cause of chronic nasal obstruction, and radiofrequency treatment has become an effective minimally invasive option for management. However, the impact of this procedure on nasal bacterial flora and the need for postoperative antibiotics remains unclear.ObjectiveTo investigate the effect of inferior turbinate radiofrequency treatment on the nasal cavity bacterial flora and the need for postoperative antibiotics.MethodsForty-five voluntary patie...",,
2025-Nov,,40833283,"Response to the Letter to the Editor by Deng and Lv Regarding ""Superior Benefits of Combining Mepolizumab With Sinus Surgery Compared to Mepolizumab Alone: Results From a Randomised 6-Month Trial"".",International forum of allergy & rhinology,"Homoe, Anne-Sophie",10.1002/alr.70022,,,
2025-Nov,,40825100,"Response to Letter Regarding ""Accurate Detection of Cerebrospinal Fluid by DNA Aptamers Derived by Clinical Samples"".",International forum of allergy & rhinology,"Chen, Xinlei; Abiri, Arash; Hsu, Frank P K; Luptak, Andrej; Khine, Michelle et al.",10.1002/alr.70021,,,
2025-Nov,,40825091,"Correspondence Regarding ""Accurate Detection of Cerebrospinal Fluid by DNA Aptamers Derived by Clinical Samples"".",International forum of allergy & rhinology,"Min, Hyun Jin",10.1002/alr.70018,,,
2025-Nov,,40820948,In Response to Factors Associated With Hearing-Related Quality of Life in Children With Hearing Loss.,The Laryngoscope,"Lieu, Judith E C; Ensing, Amy; Yang, Anna Fanghan; Kallogjeri, Dorina",10.1002/lary.32435,,,
2025-Nov,,40820344,Effect of Platelet-Rich Plasma Injection in Patients With Atrophic Rhinitis: A Systematic Review.,American journal of rhinology & allergy,"Asiry, Ali Jaber; Mubarki, Musleh Hussain; Dighriri, Ramzi Mohammed; Erwe, Ibrahem H; Munhish, Fadi Abdu et al.",10.1177/19458924251369316,"BackgroundAtrophic rhinitis (AR) is a chronic condition characterized by mucosal atrophy, crusting, and impaired mucociliary clearance. Current treatments are palliative and do not focus on tissue regeneration. Although platelet-rich plasma (PRP) has gained attention for its regenerative properties, evidence supporting its effectiveness in AR remains limited.ObjectiveTo systematically evaluate the effectiveness and safety of PRP in the treatment of AR, focusing on nasal symptom relief, mucocilia...",,
2025-Nov,,40808535,Biologics and Surgery in Chronic Rhinosinusitis With Nasal Polyps: A Comparative Outcomes Analysis.,American journal of rhinology & allergy,"Narendran, Nirushan; Samargandy, Shireen; Volpe, Sophia; Patterson, James; Gutama, Barite et al.",10.1177/19458924251366569,,,
2025-Nov,,40781917,In Reference to Factors Associated With Hearing-Related Quality of Life in Children With Hearing Loss.,The Laryngoscope,"Wang, Yihan; Leng, Hui; Qu, Rupeng",10.1002/lary.32431,,,
2025-Nov,,40781903,DNA Immunotherapy (INO-3107) Results in Long-Term Surgery Reduction in RRP.,The Laryngoscope,"Amin, Milan R; Belafsky, Peter C; Best, Simon R; Friedman, Aaron D; Klein, Adam M et al.",10.1002/lary.32416,"OBJECTIVE: To evaluate the long-term safety and clinical effect of INO-3107 immunotherapy in adults with recurrent respiratory papillomatosis (RRP). METHODS: RRP-002 was a retrospective, observational extension study that followed patients enrolled in the 52-week RRP-001 study. Patients with moderate to severe juvenile or adult-onset RRP who had undergone ≥ 2 surgical interventions in the year preceding dosing were eligible for enrollment in RRP-001. Participants underwent surgical debulking wit...",,
2025-Nov,,40760843,Vericiguat Enhances Olfactory Function in Post-Infectious Anosmia: A Randomized Pilot Double-Blind Placebo-Controlled Trial.,American journal of rhinology & allergy,"Alharbi, Adnan; Abdelazim, Mohamed H; Alshammari, Abdullah S; Algarni, Majed A; Alzarea, Abdulaziz Ibrahim et al.",10.1177/19458924251364571,"BackgroundOlfactory dysfunction affects approximately 29% of the population and has a profound impact on quality of life. It frequently follows upper respiratory tract infections and lacks effective pharmacological treatments. Vericiguat, a soluble guanylate cyclase stimulator that increases intracellular cyclic guanosine monophosphate, is approved for heart failure and has potential neuro-modulatory effects relevant to olfactory processing.ObjectiveThis pilot study investigates the efficacy of ...",,
2025-Nov,,40760831,Three-Year Outcomes After Temperature-Controlled Radiofrequency Ablation of the Posterior Nasal Nerve for Chronic Rhinitis.,American journal of rhinology & allergy,"Lee, Jivianne T; Abbas, Gregory M; Charous, Daniel D; Cuevas, Mandy; Göktas, Önder et al.",10.1177/19458924251360889,"BackgroundChronic rhinitis (CR) is characterized by refractory symptoms such as rhinorrhea, sneezing, nasal congestion, postnasal drip (PND), and cough. Most patients do not achieve lasting symptom relief with medical management.ObjectiveTo evaluate the long-term efficacy and safety of temperature-controlled radiofrequency treatment targeting posterior nasal nerves (PNNs) for CR.MethodsThis prospective, single-arm, open-label, multicenter study included patients aged 18-85 years across 19 center...",,
2025-Nov,,40757398,Innovative Technique: Fixation of Receiver Stimulator of Cochlear Implant.,The Laryngoscope,"Kirtane, Milind V; Varty, Sangeeta P; Dangol, Bhawana; Hawkes, Gabriela C",10.1002/lary.70014,This is an innovative and easy technique for fixation of the receiver stimulator of a cochlear implant. This novel method prevents migration of the device and avoids dural complications.,,
2025-Nov,,40747757,Deciphering the Significance of Vocal Fold Motility in Laryngeal Cancer: Time for a Paradigm Shift?,The Laryngoscope,"Marchi, Filippo; Iandelli, Andrea; Bellini, Elisa; Peretti, Giorgio",10.1002/lary.32483,,,
2025-Nov,,40746260,Transcaruncular Approach With Orbital Protection for Resection of Sinonasal Lesions: How I do it.,American journal of rhinology & allergy,"Fischer, Jakob L; Roelofs, Kelsey A; Saffari, Persiana S; Suh, Jeff D; Rootman, Daniel B et al.",10.1177/19458924251364570,BackgroundMinimally invasive techniques for the resection of sinonasal masses have become increasingly important over the past few decades. Sinonasal disease involving the lamina papyracea remains difficult to manage given the risk of injury to critical orbital structures and hemorrhage from nearby vessels.ObjectiveDetail the transcaruncular approach with orbital protection for the resection of benign and malignant sinonasal pathologies.MethodsDescription of surgical technique and presentation o...,,
2025-Nov,,40734421,Evaluation of Serum Omentin-1 Level in Phenotypes of Chronic Rhinosinusitis.,American journal of rhinology & allergy,"Dayısoylu, Selin; Ersözlü, Tolga; Gültekin, Erdogan; Celikkol, Aliye",10.1177/19458924251363165,"BackgroundChronic rhinosinusitis (CRS) is a common inflammatory condition of the paranasal sinuses and nasal mucosa. Despite significant advances in understanding its pathogenesis, CRS remains a complex condition to manage due to its heterogeneous nature. Identifying biomarkers could be beneficial in enhancing the diagnostic accuracy and guiding personalized treatment strategies for CRS patients.ObjectiveThis study aimed to evaluate Omentin-1 usage as a biomarker in CRS patients and to investiga...",,
2025-Nov,,40685625,Association Between Limited Airflow in Olfactory Cleft and Impaired Olfactory Function: A Systematic Review.,American journal of rhinology & allergy,"Wei, Yajie; Jiang, Xincen; Li, Yankun; Chen, Lina; Wu, Dawei",10.1177/19458924251360408,,,
2025-Nov,,40685623,Aqueous Versus Aerosol Intranasal Corticosteroid Spray for Allergic Rhinitis: Systematic Review and Meta-Analysis.,American journal of rhinology & allergy,"Levy, Dylan A; Bakare, Ajibola B; Gurevich, Robert E; McCoul, Edward D",10.1177/19458924251360917,,,
2025-Nov,,40682374,The Role of FNA-CYFRA 21-1 in Cervical Lymph Node Metastasis of Differentiated Thyroid Cancer.,The Laryngoscope,"Yu, Xiuqiao; Li, Peipei; Chen, Xiao; Chen, Ziqi; Li, Li",10.1002/lary.32426,"OBJECTIVE: To investigate the role of fine needle aspiration thyroglobulin (FNA-TG) and fine needle aspiration cytokeratin 19 fragment antigen 21-1 (FNA-CYFRA 21-1) in the diagnosis of cervical lymph node metastasis of differentiated thyroid carcinoma (DTC), then analyze whether different neck lymph node compartmentalization affected the cut-off values of FNA-TG and FNA-CYFRA 21-1. METHODS: One hundred and sixteen lymph nodes with suspicious ultrasound signs between September 2023 and September ...",,
2025-Nov,,40679157,In Reference to Improved Recovery After Vestibular Schwannoma Excision With Intratympanic Gentamicin Prehabilitation.,The Laryngoscope,"Warner, Elinor; Jelicic, Tanja; Wong, Michelle; Correia, Jason; Neeff, Michel",10.1002/lary.32429,,,
2025-Nov,,40673661,Association of Hypothyroidism With Wound Complications Post-Laryngectomy: A Systematic Review and Meta-Analysis.,The Laryngoscope,"Kennedy, Eoghan J; Cleere, Eoin F; Hintze, Justin M; Fitzgerald, Conall W R",10.1002/lary.32324,"OBJECTIVE: Patients undergoing laryngectomy may be rendered hypothyroid following surgery or due to radiation therapy. Hypothyroidism impairs wound healing, which may increase the risk of wound complications such as pharyngocutaneous fistula (PCF). This study aims to investigate if hypothyroidism is associated with post-laryngectomy wound complications. DATA SOURCES: PubMed, Embase, Scopus, and the Cochrane Library were searched for relevant studies from database inception until January 2025. RE...",,
2025-Nov,,40673644,In Response to Bariatric Surgery Lowers Incidence of Chronic Rhinosinusitis and Functional Endoscopic Sinus Surgery.,The Laryngoscope,"Thatte, Shvetali; Chaaban, Mohamad R",10.1002/lary.32443,,,
2025-Nov,,40673643,In Reference to Bariatric Surgery Lowers Incidence of Chronic Rhinosinusitis and Functional Endoscopic Sinus Surgery.,The Laryngoscope,"Desonniaux, Marie; Barillari, Maria R; Bonavina, Luigi; Dapri, Giovanni; Lechien, Jerome R",10.1002/lary.32442,,,
2025-Nov,,40667670,Myofascial Release Therapy Augments the Effect of Voice Therapy in Patients With Cervicalgia.,The Laryngoscope,"Gillespie, Megan R; Williams, Mady; Casey, Benjamin; Gilbert, Mark R",10.1002/lary.32422,"OBJECTIVES: To analyze the synergistic effects of myofascial release physical therapy (MFRPT) and voice therapy (VT) in reducing symptom severity for patients diagnosed with cervicalgia and associated functional laryngeal conditions. METHODS: This retrospective analysis included adult patients with cervicalgia and functional laryngeal conditions-muscle tension dysphonia (MTDa), muscle tension dysphagia (MTDg), chronic cough (CC), or globus sensation (GP)-at a tertiary care center. Patients recei...",,
2025-Nov,,40662411,Comprehensive Management of Obstructive Sleep Apnea With CPAP in a Surgical Otolaryngology Practice.,The Laryngoscope,"Llerena, Pablo; Kaki, Praneet; DeKloe, Jefferson; Kim, Sooji; Jackson, Julian et al.",10.1002/lary.32373,OBJECTIVE: This study aims to investigate the medical management of obstructive sleep apnea (OSA) utilizing continuous positive airway pressure (CPAP) by the Otolaryngology departments within a tertiary care institution. METHODS: Data was retrospectively reviewed from electronic medical records over 12 months. Patients were categorized into two cohorts based on the department managing their treatment with CPAP therapy: Otolaryngology or Sleep Medicine. Loss to follow-up was defined as the absenc...,,
2025-Nov,,40631799,In Response to RADA-16 Reduces Postoperative Epistaxis After Inferior Turbinate Submucosal Resection.,The Laryngoscope,"Xu, Annie; Kwon, Emily; Feng, Anne Y; Hsueh, Wayne Daniel",10.1002/lary.32423,,,
2025-Nov,,40631784,In Reference to RADA-16 Reduces Postoperative Epistaxis After Inferior Turbinate Submucosal Resection.,The Laryngoscope,"Ashish, Sharad; Ravindranath, Preethi",10.1002/lary.32418,,,
2025-Nov,,40631777,Association of Laryngeal Dystonia With Common Neurologic Disorders.,The Laryngoscope,"LaBarge, Brandon; Lorenz, F Jeffrey; Gniady, John P",10.1002/lary.32407,"OBJECTIVE: Laryngeal dystonia is a heterogenous disorder consisting of involuntary spasms of laryngeal muscles. There are multiple forms including adductor, abductor, and mixed phenotypes. The disorder is thought to be multifactorial, with various reported associations with family history of dystonia or movement disorders. The relationship between laryngeal dystonia and various neurologic disorders is not well defined in the literature. METHODS: We utilized the TriNetX de-identified electronic m...",,
2025-Nov,,40626789,Reconstruction of a Large Cricothyroid Defect Using a Synthetic Hybrid-Scale Fiber Matrix.,The Laryngoscope,"Asi, Karim; Tkaczuk, Andrew",10.1002/lary.32402,"We report a case of a complete cricothyroid membrane soft tissue defect successfully reconstructed with a synthetic, resorbable, hybrid-scale fiber matrix (Restrata). This matrix offers an alternative to traditional allogeneic, xenogeneic, and biologic reconstructive options while potentially avoiding the complications associated with it.",,
2025-Nov,,40616414,Laryngeal Sensory Neuropathic Cough Is Not Associated With Membranous Vocal Fold Lesions.,The Laryngoscope,"Razura, Diego E; Gallagher, Tyler; Khachikyan, Nyree; Johns, Michael M; Shuman, Elizabeth A",10.1002/lary.32391,"OBJECTIVES: Examine the association between laryngeal sensory neuropathic cough (LSNC) and membranous vocal fold (VF) lesions. Understand the clinical presentation and challenges in diagnosing this idiopathic condition. METHODS: A retrospective review was conducted of adult patients with chronic cough (> 8 weeks) seen at a tertiary academic laryngology center from 2015 to 2020. Laryngeal videostroboscopy exams were reviewed. Demographics, cough severity index (CSI), and chronic cough duration we...",,
2025-Nov,,40613547,Human Papillomavirus Exposure Risk and Vaccination Awareness Among Laryngeal Surgeons: A Worldwide Survey Study.,The Laryngoscope,"Chen, Tiexin; Prasad, Jasmine; Robotti, Carlo; Karagama, Yakubu; Dikkers, Frederik G et al.",10.1002/lary.32401,"OBJECTIVE: To explore both the awareness of the risk of human papillomavirus (HPV) transmission during recurrent respiratory papillomatosis (RRP) surgeries and the knowledge of HPV vaccination as a preventive measure among laryngeal surgeons. METHODS: A 22-question cross-sectional survey distributed electronically to members of the European Laryngology Society (ELS) and the Union of the European Phoniatricians (UEP) between May 2024 and July 2024. RESULTS: A total of 158 responses were included,...",,
